Mon, 2013.03.04 22:25, 22:25, AUD, low, AIG Services Index, 45.3, , 48.5
Tue, 2013.03.05 0:00, 0:00, GBP, medium, BRC Retail Sales Monitor y/y, 1.9%, , 2.7%
Tue, 2013.03.05 0:30, 0:30, AUD, high, Retail Sales m/m, -0.4%, 0.4%, 0.9%
Tue, 2013.03.05 0:30, 0:30, AUD, medium, Current Account, -15.0B, -15.4B, -14.7B
Tue, 2013.03.05 1:30, 1:30, JPY, medium, Average Cash Earnings y/y, -1.7%, -0.3%, 0.7%
Tue, 2013.03.05 1:45, 1:45, CNY, low, Caixin Services PMI, 54.0, , 52.1
Tue, 2013.03.05 3:30, 3:30, AUD, high, Cash Rate, 3.00%, 3.00%, 3.00%
Tue, 2013.03.05 3:30, 3:30, AUD, high, RBA Rate Statement, , , 
Tue, 2013.03.05 3:45, 3:45, JPY, low, 10-y Bond Auction, 0.80|2.8, , 0.64|2.4
Tue, 2013.03.05 8:15, 8:15, EUR, high, Spanish Services PMI, 47.0, 45.9, 44.7
Tue, 2013.03.05 8:45, 8:45, EUR, high, Italian Services PMI, 43.9, 43.6, 43.6
Tue, 2013.03.05 8:50, 8:50, EUR, low, French Final Services PMI, 42.7, 42.7, 42.7
Tue, 2013.03.05 8:55, 8:55, EUR, low, German Final Services PMI, 54.1, 54.1, 54.1
Tue, 2013.03.05 9:00, 9:00, EUR, low, Final Services PMI, 47.3, 47.3, 47.9
Tue, 2013.03.05 5:00, 5:00, EUR, medium, ECOFIN Meetings, , , 
Tue, 2013.03.05 9:30, 9:30, GBP, high, Final Services PMI, 51.5, 51.1, 51.8
Tue, 2013.03.05 10:00, 10:00, EUR, medium, Retail Sales m/m, -0.8%, 0.3%, 1.2%
Tue, 2013.03.05 13:30, 13:30, NZD, low, GDT Price Index, 4.1%, , 11.5%
Tue, 2013.03.05 15:00, 15:00, USD, high, ISM Services PMI, 55.2, 55.0, 56.0
Tue, 2013.03.05 15:00, 15:00, USD, low, IBD/TIPP Economic Optimism, 47.3, 47.8, 42.2
Wed, 2013.03.06 0:01, 0:01, GBP, low, BRC Shop Price Index y/y, 0.6%, , 1.1%
Wed, 2013.03.06 0:30, 0:30, AUD, high, GDP q/q, 0.7%, 0.6%, 0.6%
Wed, 2013.03.06 8:00, 8:00, GBP, medium, Halifax HPI m/m, -0.3%, 0.4%, 0.5%
Wed, 2013.03.06 9:45, 9:45, GBP, high, BOE Gov King Speaks, , , 
Wed, 2013.03.06 10:00, 10:00, EUR, low, Revised GDP q/q, -0.6%, -0.6%, -0.6%
Wed, 2013.03.06 13:15, 13:15, USD, high, ADP Non-Farm Employment Change, 215K, 172K, 198K
Wed, 2013.03.06 15:00, 15:00, CAD, high, BOC Rate Statement, , , 
Wed, 2013.03.06 15:00, 15:00, CAD, high, Ivey PMI, 58.9, 56.2, 51.1
Wed, 2013.03.06 15:00, 15:00, CAD, high, Overnight Rate, 1.00%, 1.00%, 1.00%
Wed, 2013.03.06 15:00, 15:00, USD, medium, Factory Orders m/m, 1.3%, -2.2%, -2.0%
Wed, 2013.03.06 15:30, 15:30, USD, medium, Crude Oil Inventories, 1.1M, 0.9M, 3.8M
Wed, 2013.03.06 19:00, 19:00, USD, medium, Beige Book, , , 
Wed, 2013.03.06 22:26, 22:26, AUD, low, AIG Construction Index, 36.2, , 45.6
Thu, 2013.03.07 0:30, 0:30, AUD, high, Trade Balance, -0.69B, -0.51B, -1.06B
Thu, 2013.03.07 3:24, 3:24, JPY, high, Monetary Policy Statement, , , 
Thu, 2013.03.07 3:24, 3:24, JPY, high, Overnight Call Rate, <0.10%, <0.10%, <0.10%
Thu, 2013.03.07 17:00, 17:00, JPY, low, Leading Indicators, 93.2%, 96.2%, 96.3%
Thu, 2013.03.07 6:45, 6:45, CHF, low, Unemployment Rate, 3.1%, 3.1%, 3.1%
Thu, 2013.03.07 7:32, 7:32, JPY, high, BOJ Press Conference, , , 
Thu, 2013.03.07 7:45, 7:45, EUR, low, French Trade Balance, -5.4B, -4.8B, -5.9B
Thu, 2013.03.07 8:00, 8:00, CHF, high, Foreign Currency Reserves, 430B, , 428B
Thu, 2013.03.07 9:00, 9:00, CHF, high, SNB Chairman Jordan Speaks, , , 
Thu, 2013.03.07 9:45, 9:45, EUR, high, Spanish 10-y Bond Auction, 5.20|1.6, , 4.92|2.3
Thu, 2013.03.07 9:59, 9:59, EUR, medium, French 10-y Bond Auction, 2.30|3.1, , 2.10|2.2
Thu, 2013.03.07 11:00, 11:00, EUR, medium, German Factory Orders m/m, 1.1%, 0.6%, -1.9%
Thu, 2013.03.07 12:00, 12:00, GBP, high, Asset Purchase Facility, 375B, 375B, 375B
Thu, 2013.03.07 12:00, 12:00, GBP, high, Official Bank Rate, 0.50%, 0.50%, 0.50%
Thu, 2013.03.07 12:30, 12:30, USD, low, Challenger Job Cuts y/y, -24.4%, , 7.0%
Thu, 2013.03.07 12:45, 12:45, EUR, high, Main Refinancing Rate, 0.75%, 0.75%, 0.75%
Thu, 2013.03.07 13:30, 13:30, CAD, high, Building Permits m/m, -10.4%, 5.4%, 1.7%
Thu, 2013.03.07 13:30, 13:30, CAD, high, Trade Balance, -0.3B, -0.6B, -0.2B
Thu, 2013.03.07 13:30, 13:30, EUR, high, ECB Press Conference, , , 
Thu, 2013.03.07 13:30, 13:30, USD, high, Trade Balance, -38.1B, -42.8B, -44.4B
Thu, 2013.03.07 13:30, 13:30, USD, high, Unemployment Claims, 347K, 354K, 340K
Thu, 2013.03.07 13:30, 13:30, USD, medium, Revised Nonfarm Productivity q/q, -2.0%, -1.6%, -1.9%
Thu, 2013.03.07 13:30, 13:30, USD, low, Revised Unit Labor Costs q/q, 4.5%, 4.4%, 4.6%
Thu, 2013.03.07 15:30, 15:30, USD, low, Natural Gas Storage, -171B, -135B, -146B
Thu, 2013.03.07 18:15, 18:15, USD, medium, FOMC Member Powell Speaks, , , 
Thu, 2013.03.07 20:00, 20:00, USD, low, Consumer Credit m/m, 15.1B, 15.2B, 16.2B
Thu, 2013.03.07 21:30, 21:30, USD, medium, Bank Stress Test Results, , , 
Thu, 2013.03.07 21:45, 21:45, NZD, low, Manufacturing Sales q/q, 1.7%, , 0.0%
Thu, 2013.03.07 23:50, 23:50, JPY, high, Current Account, 0.11T, 0.11T, 0.36T
Thu, 2013.03.07 23:50, 23:50, JPY, medium, Final GDP q/q, -0.1%, -0.1%, 0.0%
Thu, 2013.03.07 23:50, 23:50, JPY, low, Bank Lending y/y, 1.3%, , 1.5%
Thu, 2013.03.07 23:50, 23:50, JPY, low, Final GDP Price Index y/y, -0.6%, -0.6%, -0.7%
Fri, 2013.03.08 2:02, 2:02, CNY, high, USD-Denominated Trade Balance, 29.2B, -8.8B, 15.3B
Fri, 2013.03.08 3:45, 3:45, JPY, low, 30-y Bond Auction, 1.99|3.5, , 1.82|3.3
Fri, 2013.03.08 17:00, 17:00, JPY, low, BOJ Monthly Report, , , 
Fri, 2013.03.08 17:00, 17:00, JPY, low, Economy Watchers Sentiment, 49.5, 51.2, 53.2
Fri, 2013.03.08 7:45, 7:45, EUR, low, French Gov Budget Balance, -87.2B, , -12.8B
Fri, 2013.03.08 8:15, 8:15, CHF, high, CPI m/m, -0.3%, -0.3%, 0.3%
Fri, 2013.03.08 9:30, 9:30, GBP, medium, Consumer Inflation Expectations, 3.5%, , 3.6%
Fri, 2013.03.08 11:00, 11:00, EUR, medium, German Industrial Production m/m, 0.6%, 0.6%, 0.0%
Fri, 2013.03.08 13:13, 13:13, CAD, low, Housing Starts, 159K, 173K, 181K
Fri, 2013.03.08 13:30, 13:30, CAD, high, Employment Change, -21.9K, 7.8K, 50.7K
Fri, 2013.03.08 13:30, 13:30, CAD, high, Unemployment Rate, 7.0%, 7.1%, 7.0%
Fri, 2013.03.08 13:30, 13:30, CAD, medium, Labor Productivity q/q, -0.4%, -0.1%, 0.1%
Fri, 2013.03.08 13:30, 13:30, USD, high, Non-Farm Employment Change, 119K, 162K, 236K
Fri, 2013.03.08 13:30, 13:30, USD, high, Unemployment Rate, 7.9%, 7.9%, 7.7%
Fri, 2013.03.08 13:30, 13:30, USD, medium, Average Hourly Earnings m/m, 0.1%, 0.2%, 0.2%
Fri, 2013.03.08 15:00, 15:00, USD, low, Final Wholesale Inventories m/m, 0.1%, 0.4%, 1.2%
Sat, 2013.03.09 1:00, 1:00, USD, low, FOMC Member Duke Speaks, , , 
Sat, 2013.03.09 1:30, 1:30, CNY, high, CPI y/y, 2.0%, 3.0%, 3.2%
Sat, 2013.03.09 1:30, 1:30, CNY, medium, PPI y/y, -1.6%, -1.5%, -1.6%
Mon, 2013.03.11 7:03, 7:03, JPY, low, Prelim Machine Tool Orders y/y, -26.4%, , -21.5%
Mon, 2013.03.11 8:00, 8:00, EUR, low, German Trade Balance, 16.9B, 17.9B, 15.7B
Mon, 2013.03.11 8:45, 8:45, EUR, medium, French Industrial Production m/m, 0.9%, -0.1%, -1.2%
Mon, 2013.03.11 9:15, 9:15, CHF, medium, Retail Sales y/y, 4.7%, 3.7%, 1.9%
Tue, 2013.03.12 0:50, 0:50, JPY, medium, BSI Manufacturing Index, -10.3, -6.2, -4.6
Tue, 2013.03.12 0:50, 0:50, JPY, medium, Monetary Policy Meeting Minutes, , , 
Tue, 2013.03.12 0:50, 0:50, JPY, medium, Tertiary Industry Activity m/m, 1.1%, -0.1%, -1.1%
Tue, 2013.03.12 0:50, 0:50, JPY, low, PPI y/y, -0.3%, -0.1%, -0.1%
Tue, 2013.03.12 1:01, 1:01, GBP, medium, RICS House Price Balance, -4%, -1%, -6%
Tue, 2013.03.12 1:27, 1:27, NZD, medium, REINZ HPI m/m, -1.0%, , 1.6%
Tue, 2013.03.12 1:30, 1:30, AUD, medium, NAB Business Confidence, 3, , 1
Tue, 2013.03.12 6:00, 6:00, JPY, low, Consumer Confidence, 43.3, 43.0, 44.3
Tue, 2013.03.12 8:00, 8:00, EUR, low, German Final CPI m/m, 0.6%, 0.6%, 0.6%
Tue, 2013.03.12 8:00, 8:00, EUR, low, German WPI m/m, 0.3%, 0.4%, 0.1%
Tue, 2013.03.12 10:30, 10:30, GBP, high, Manufacturing Production m/m, 1.5%, 0.0%, -1.5%
Tue, 2013.03.12 10:30, 10:30, GBP, medium, Goods Trade Balance, -8.7B, -8.8B, -8.2B
Tue, 2013.03.12 10:30, 10:30, GBP, low, Industrial Production m/m, 1.1%, 0.1%, -1.2%
Tue, 2013.03.12 12:30, 12:30, USD, low, NFIB Small Business Index, 88.9, 91.3, 90.8
Tue, 2013.03.12 15:57, 15:57, GBP, medium, NIESR GDP Estimate, -0.2%, , -0.1%
Tue, 2013.03.12 16:00, 16:00, USD, medium, JOLTS Job Openings, 3.61M, 3.67M, 3.69M
Tue, 2013.03.12 22:45, 22:45, NZD, low, FPI m/m, 1.9%, , -0.3%
Wed, 2013.03.13 0:30, 0:30, AUD, medium, Westpac Consumer Sentiment, 7.7%, , 2.0%
Wed, 2013.03.13 1:30, 1:30, AUD, medium, Home Loans m/m, -2.1%, 0.2%, -1.5%
Wed, 2013.03.13 7:30, 7:30, EUR, low, French Final Private Payrolls q/q, -0.2%, -0.2%, -0.3%
Wed, 2013.03.13 8:45, 8:45, EUR, low, French Final CPI m/m, -0.5%, 0.5%, 0.3%
Wed, 2013.03.13 11:00, 11:00, EUR, medium, Industrial Production m/m, 0.9%, -0.1%, -0.4%
Wed, 2013.03.13 13:30, 13:30, USD, high, Core Retail Sales m/m, 0.4%, 0.5%, 1.0%
Wed, 2013.03.13 13:30, 13:30, USD, high, Retail Sales m/m, 0.2%, 0.5%, 1.1%
Wed, 2013.03.13 13:30, 13:30, USD, medium, Import Prices m/m, 0.6%, 0.5%, 1.1%
Wed, 2013.03.13 15:00, 15:00, USD, medium, Business Inventories m/m, 0.3%, 0.5%, 1.0%
Wed, 2013.03.13 15:30, 15:30, USD, medium, Crude Oil Inventories, 3.8M, 2.3M, 2.6M
Wed, 2013.03.13 18:00, 18:00, USD, medium, 10-y Bond Auction, 2.05|2.7, , 2.03|3.2
Wed, 2013.03.13 18:20, 18:20, USD, medium, Federal Budget Balance, 2.9B, -200.0B, -203.5B
Wed, 2013.03.13 21:00, 21:00, NZD, high, Official Cash Rate, 2.50%, 2.50%, 2.50%
Wed, 2013.03.13 21:00, 21:00, NZD, high, RBNZ Press Conference, , , 
Wed, 2013.03.13 21:00, 21:00, NZD, high, RBNZ Rate Statement, , , 
Wed, 2013.03.13 21:00, 21:00, NZD, medium, RBNZ Monetary Policy Statement, , , 
Thu, 2013.03.14 1:00, 1:00, AUD, medium, MI Inflation Expectations, 2.2%, , 2.3%
Thu, 2013.03.14 1:01, 1:01, GBP, low, BOE Quarterly Bulletin, , , 
Thu, 2013.03.14 1:05, 1:05, NZD, high, RBNZ Gov Wheeler Speaks, , , 
Thu, 2013.03.14 1:30, 1:30, AUD, high, Employment Change, 13.1K, 9.5K, 71.5K
Thu, 2013.03.14 1:30, 1:30, AUD, high, Unemployment Rate, 5.4%, 5.5%, 5.4%
Thu, 2013.03.14 17:30, 17:30, JPY, low, Revised Industrial Production m/m, 1.0%, 1.0%, 0.3%
Thu, 2013.03.14 8:00, 8:00, AUD, medium, RBA Assist Gov Kent Speaks, , , 
Thu, 2013.03.14 9:30, 9:30, CHF, high, Libor Rate, <0.25%, <0.25%, <0.25%
Thu, 2013.03.14 9:30, 9:30, CHF, high, SNB Monetary Policy Assessment, , , 
Thu, 2013.03.14 10:00, 10:00, EUR, medium, ECB Monthly Bulletin, , , 
Thu, 2013.03.14 5:00, 5:00, EUR, high, EU Economic Summit, , , 
Thu, 2013.03.14 11:00, 11:00, EUR, low, Final Employment Change q/q, -0.1%, -0.1%, -0.3%
Thu, 2013.03.14 13:30, 13:30, CAD, medium, NHPI m/m, 0.2%, 0.1%, 0.1%
Thu, 2013.03.14 13:30, 13:30, CAD, low, Capacity Utilization Rate, 81.1%, 80.8%, 80.7%
Thu, 2013.03.14 13:30, 13:30, USD, high, PPI m/m, 0.2%, 0.7%, 0.7%
Thu, 2013.03.14 13:30, 13:30, USD, high, Unemployment Claims, 342K, 348K, 332K
Thu, 2013.03.14 13:30, 13:30, USD, medium, Core PPI m/m, 0.2%, 0.2%, 0.2%
Thu, 2013.03.14 13:30, 13:30, USD, medium, Current Account, -112B, -111B, -110B
Thu, 2013.03.14 14:00, 14:00, USD, medium, FOMC Member Raskin Speaks, , , 
Thu, 2013.03.14 15:30, 15:30, USD, low, Natural Gas Storage, -146B, -136B, -145B
Thu, 2013.03.14 18:00, 18:00, USD, low, 30-y Bond Auction, 3.18|2.7, , 3.25|2.4
Thu, 2013.03.14 21:30, 21:30, USD, low, Bank Stress Test Results, , , 
Thu, 2013.03.14 22:30, 22:30, NZD, medium, BusinessNZ Manufacturing Index, 55.2, , 56.3
Fri, 2013.03.15 0:00, 0:00, NZD, low, RBNZ Assist Gov McDermott Speaks, , , 
Fri, 2013.03.15 9:15, 9:15, CHF, medium, PPI m/m, -0.1%, 0.3%, 0.1%
Fri, 2013.03.15 5:00, 5:00, EUR, medium, EU Economic Summit, , , 
Fri, 2013.03.15 5:00, 5:00, EUR, medium, Eurogroup Meetings, , , 
Fri, 2013.03.15 11:00, 11:00, EUR, medium, Final CPI y/y, 1.8%, 1.8%, 1.8%
Fri, 2013.03.15 11:00, 11:00, EUR, medium, Final Core CPI y/y, 1.3%, 1.3%, 1.3%
Fri, 2013.03.15 11:00, 11:00, GBP, low, CB Leading Index m/m, 0.0%, , 0.4%
Fri, 2013.03.15 12:00, 12:00, GBP, medium, MPC Member Dale Speaks, , , 
Fri, 2013.03.15 13:30, 13:30, USD, high, CPI y/y, 1.6%, 1.9%, 2.0%
Fri, 2013.03.15 13:30, 13:30, USD, high, Core CPI m/m, 0.3%, 0.2%, 0.2%
Fri, 2013.03.15 13:30, 13:30, USD, medium, CPI m/m, 0.0%, 0.6%, 0.7%
Fri, 2013.03.15 13:30, 13:30, USD, medium, Empire State Manufacturing Index, 10.0, 9.8, 9.2
Fri, 2013.03.15 14:00, 14:00, USD, medium, TIC Long-Term Purchases, 64.2B, 39.3B, 25.7B
Fri, 2013.03.15 14:12, 14:12, USD, medium, Capacity Utilization Rate, 79.2%, 79.4%, 79.6%
Fri, 2013.03.15 14:12, 14:12, USD, medium, Industrial Production m/m, 0.0%, 0.4%, 0.7%
Fri, 2013.03.15 14:55, 14:55, USD, high, Prelim UoM Consumer Sentiment, 77.6, 78.2, 71.8
Fri, 2013.03.15 14:55, 14:55, USD, low, Prelim UoM Inflation Expectations, 3.3%, , 3.3%
Mon, 2013.03.18 7:45, 7:45, CHF, low, SECO Economic Forecasts, , , 
Mon, 2013.03.18 10:00, 10:00, EUR, low, Italian Trade Balance, 2.11B, 2.11B, -1.62B
Mon, 2013.03.18 5:00, 5:00, EUR, high, Eurogroup Meetings, , , 
Mon, 2013.03.18 11:00, 11:00, EUR, medium, ZEW Economic Sentiment, , , 
Mon, 2013.03.18 11:00, 11:00, EUR, low, Trade Balance, 10.3B, 10.4B, 9.0B
Mon, 2013.03.18 12:00, 12:00, EUR, medium, German Buba Monthly Report, , , 
Mon, 2013.03.18 13:30, 13:30, CAD, medium, Foreign Securities Purchases, -1.92B, 7.85B, 13.34B
Mon, 2013.03.18 15:00, 15:00, USD, low, NAHB Housing Market Index, 46, 48, 44
Mon, 2013.03.18 23:15, 23:15, AUD, medium, RBA Deputy Gov Debelle Speaks, , , 
Mon, 2013.03.18 23:50, 23:50, AUD, medium, RBA Deputy Gov Lowe Speaks, , , 
Tue, 2013.03.19 1:30, 1:30, AUD, high, Monetary Policy Meeting Minutes, , , 
Tue, 2013.03.19 3:00, 3:00, CNY, low, CB Leading Index m/m, 1.3%, , 1.3%
Tue, 2013.03.19 3:00, 3:00, CNY, low, Foreign Direct Investment ytd/y, -7.3%, , -1.4%
Tue, 2013.03.19 10:00, 10:00, EUR, low, Italian Industrial Production m/m, -0.2%, -0.3%, 0.8%
Tue, 2013.03.19 10:30, 10:30, GBP, high, CPI y/y, 2.7%, 2.8%, 2.8%
Tue, 2013.03.19 10:30, 10:30, GBP, high, PPI Input m/m, 1.3%, 1.7%, 3.2%
Tue, 2013.03.19 10:30, 10:30, GBP, medium, RPI y/y, 3.3%, 3.3%, 3.2%
Tue, 2013.03.19 10:30, 10:30, GBP, low, Core CPI y/y, 2.3%, 2.2%, 2.3%
Tue, 2013.03.19 10:30, 10:30, GBP, low, ONS HPI y/y, 3.3%, 2.6%, 2.2%
Tue, 2013.03.19 10:30, 10:30, GBP, low, PPI Output m/m, 0.2%, 0.2%, 0.8%
Tue, 2013.03.19 11:00, 11:00, EUR, high, German ZEW Economic Sentiment, 48.2, 47.9, 48.5
Tue, 2013.03.19 11:00, 11:00, EUR, medium, ZEW Economic Sentiment, 42.4, 43.7, 33.4
Tue, 2013.03.19 13:30, 13:30, CAD, high, Manufacturing Sales m/m, -3.3%, 0.7%, -0.2%
Tue, 2013.03.19 13:30, 13:30, CAD, medium, Wholesale Sales m/m, -1.1%, 0.4%, 0.3%
Tue, 2013.03.19 13:30, 13:30, USD, high, Building Permits, 0.90M, 0.93M, 0.95M
Tue, 2013.03.19 13:30, 13:30, USD, medium, Housing Starts, 0.91M, 0.92M, 0.92M
Tue, 2013.03.19 14:30, 14:30, NZD, low, GDT Price Index, 11.5%, , 14.7%
Tue, 2013.03.19 22:45, 22:45, NZD, medium, Current Account, -4.39B, -2.97B, -3.26B
Wed, 2013.03.20 0:30, 0:30, AUD, low, MI Leading Index m/m, 0.3%, , 0.3%
Tue, 2013.03.19 5:00, 5:00, JPY, holiday, Bank Holiday, , , 
Wed, 2013.03.20 8:00, 8:00, EUR, medium, German PPI m/m, 0.8%, 0.2%, -0.1%
Wed, 2013.03.20 10:00, 10:00, EUR, medium, Current Account, 16.0B, 7.9B, 14.8B
Wed, 2013.03.20 10:30, 10:30, GBP, high, Claimant Count Change, -10.0K, -5.2K, -1.5K
Wed, 2013.03.20 10:30, 10:30, GBP, high, MPC Asset Purchase Facility Votes, 3-0-6, 3-0-6, 3-0-6
Wed, 2013.03.20 10:30, 10:30, GBP, high, MPC Official Bank Rate Votes, 0-0-9, 0-0-9, 0-0-9
Wed, 2013.03.20 10:30, 10:30, GBP, medium, Unemployment Rate, 7.8%, 7.8%, 7.8%
Wed, 2013.03.20 10:30, 10:30, GBP, low, Average Earnings Index 3m/y, 1.3%, 1.5%, 1.2%
Wed, 2013.03.20 11:00, 11:00, CHF, medium, Credit Suisse Economic Expectations, 10.0, , 2.3
Wed, 2013.03.20 11:34, 11:34, EUR, medium, German 10-y Bond Auction, 1.66|1.2, , 1.36|1.6
Wed, 2013.03.20 13:30, 13:30, GBP, high, Annual Budget Release, , , 
Wed, 2013.03.20 15:30, 15:30, USD, medium, Crude Oil Inventories, 2.6M, 1.8M, -1.3M
Wed, 2013.03.20 16:00, 16:00, EUR, low, Consumer Confidence, -24, -23, -24
Wed, 2013.03.20 19:00, 19:00, USD, high, FOMC Economic Projections, , , 
Wed, 2013.03.20 19:00, 19:00, USD, high, FOMC Statement, , , 
Wed, 2013.03.20 19:00, 19:00, USD, medium, Federal Funds Rate, <0.25%, <0.25%, <0.25%
Wed, 2013.03.20 19:30, 19:30, USD, high, FOMC Press Conference, , , 
Wed, 2013.03.20 22:45, 22:45, NZD, high, GDP q/q, 0.2%, 0.9%, 1.5%
Thu, 2013.03.21 0:50, 0:50, JPY, medium, Trade Balance, -0.74T, -1.01T, -1.09T
Thu, 2013.03.21 1:30, 1:30, AUD, low, RBA Bulletin, , , 
Thu, 2013.03.21 2:45, 2:45, CNY, high, Caixin Flash Manufacturing PMI, 50.4, 51.2, 51.7
Thu, 2013.03.21 3:00, 3:00, NZD, low, Credit Card Spending y/y, 0.5%, , 4.7%
Thu, 2013.03.21 17:30, 17:30, JPY, low, All Industries Activity m/m, 1.6%, -1.1%, -1.4%
Thu, 2013.03.21 8:00, 8:00, CHF, low, Trade Balance, 2.12B, 1.87B, 2.10B
Thu, 2013.03.21 9:00, 9:00, EUR, high, French Flash Manufacturing PMI, 43.9, 44.4, 43.9
Thu, 2013.03.21 9:00, 9:00, EUR, medium, French Flash Services PMI, 42.7, 44.1, 41.9
Thu, 2013.03.21 9:30, 9:30, EUR, high, German Flash Manufacturing PMI, 50.3, 50.8, 48.9
Thu, 2013.03.21 9:30, 9:30, EUR, medium, German Flash Services PMI, 54.1, 54.9, 51.6
Thu, 2013.03.21 10:00, 10:00, EUR, medium, Flash Manufacturing PMI, 47.9, 48.2, 46.6
Thu, 2013.03.21 10:00, 10:00, EUR, medium, Flash Services PMI, 47.3, 48.2, 46.5
Thu, 2013.03.21 5:00, 5:00, EUR, high, Eurogroup Meetings, , , 
Thu, 2013.03.21 10:30, 10:30, GBP, high, Retail Sales m/m, -0.7%, 0.5%, 2.1%
Thu, 2013.03.21 10:30, 10:30, GBP, medium, Public Sector Net Borrowing, -10.3B, 8.4B, 4.4B
Thu, 2013.03.21 10:45, 10:45, EUR, high, Spanish 10-y Bond Auction, 4.92|2.3, , 4.90|1.9
Thu, 2013.03.21 11:00, 11:00, JPY, high, BOJ Gov Kuroda Speaks, , , 
Thu, 2013.03.21 12:00, 12:00, GBP, medium, CBI Industrial Order Expectations, -14, -16, -15
Thu, 2013.03.21 13:30, 13:30, CAD, high, Core Retail Sales m/m, -1.0%, 0.4%, 0.5%
Thu, 2013.03.21 13:30, 13:30, CAD, medium, Retail Sales m/m, -2.3%, 0.6%, 1.0%
Thu, 2013.03.21 13:30, 13:30, USD, high, Unemployment Claims, 334K, 343K, 336K
Thu, 2013.03.21 14:00, 14:00, USD, medium, Flash Manufacturing PMI, 54.3, 55.1, 54.9
Thu, 2013.03.21 14:00, 14:00, USD, low, HPI m/m, 0.5%, 0.7%, 0.6%
Thu, 2013.03.21 15:00, 15:00, USD, high, Existing Home Sales, 4.94M, 5.02M, 4.98M
Thu, 2013.03.21 15:00, 15:00, USD, high, Philly Fed Manufacturing Index, -12.5, -1.6, 2.0
Thu, 2013.03.21 15:00, 15:00, USD, low, CB Leading Index m/m, 0.5%, 0.3%, 0.5%
Thu, 2013.03.21 15:30, 15:30, USD, low, Natural Gas Storage, -145B, -70B, -62B
Thu, 2013.03.21 16:00, 16:00, CHF, low, SNB Quarterly Bulletin, , , 
Thu, 2013.03.21 18:00, 18:00, CHF, medium, Gov Board Member Zurbrugg Speaks, , , 
Thu, 2013.03.21 21:00, 21:00, CAD, medium, Annual Budget Release, , , 
Thu, 2013.03.21 22:45, 22:45, NZD, low, Visitor Arrivals m/m, -2.2%, , 4.1%
Fri, 2013.03.22 0:00, 0:00, AUD, medium, CB Leading Index m/m, -0.1%, , 0.2%
Fri, 2013.03.22 2:45, 2:45, AUD, medium, RBA Assist Gov Edey Speaks, , , 
Fri, 2013.03.22 10:00, 10:00, EUR, high, German ifo Business Climate, 107.4, 107.8, 106.7
Fri, 2013.03.22 15:00, 15:00, EUR, low, Belgian NBB Business Climate, -11.0, -10.3, -15.0
Mon, 2013.03.25 10:30, 10:30, GBP, medium, High Street Lending, 32.0K, 33.6K, 30.5K
Mon, 2013.03.25 16:45, 16:45, CHF, medium, Gov Board Member Danthine Speaks, , , 
Tue, 2013.03.26 5:15, 5:15, USD, low, FOMC Member Dudley Speaks, , , 
Mon, 2013.03.25 18:15, 18:15, USD, high, Fed Chairman Bernanke Speaks, , , 
Mon, 2013.03.25 22:45, 22:45, NZD, medium, Trade Balance, -287M, 2M, 414M
Tue, 2013.03.26 0:50, 0:50, JPY, low, SPPI y/y, -0.2%, 0.0%, 0.1%
Tue, 2013.03.26 1:00, 1:00, JPY, high, BOJ Gov Kuroda Speaks, , , 
Tue, 2013.03.26 17:45, 17:45, AUD, high, RBA Gov Stevens Speaks, , , 
Tue, 2013.03.26 11:00, 11:00, GBP, low, Chancellor Osborne Speaks, , , 
Tue, 2013.03.26 12:00, 12:00, GBP, medium, CBI Realized Sales, 8, 12, 0
Tue, 2013.03.26 13:30, 13:30, USD, high, Core Durable Goods Orders m/m, 2.3%, 0.7%, -0.5%
Tue, 2013.03.26 13:30, 13:30, USD, medium, Durable Goods Orders m/m, -4.9%, 3.9%, 5.7%
Tue, 2013.03.26 14:00, 14:00, USD, medium, S&P/CS Composite-20 HPI y/y, 6.8%, 7.9%, 8.1%
Tue, 2013.03.26 14:59, 14:59, USD, low, Richmond Manufacturing Index, 6, 8, 3
Tue, 2013.03.26 15:00, 15:00, USD, high, CB Consumer Confidence, 68.0, 67.9, 59.7
Tue, 2013.03.26 15:00, 15:00, USD, high, New Home Sales, 431K, 426K, 411K
Wed, 2013.03.27 5:45, 5:45, CAD, low, Gov Council Member Cote Speaks, , , 
Wed, 2013.03.27 1:00, 1:00, NZD, high, ANZ Business Confidence, 39.4, , 34.6
Wed, 2013.03.27 1:30, 1:30, AUD, medium, RBA Financial Stability Review, , , 
Wed, 2013.03.27 8:00, 8:00, CHF, low, UBS Consumption Indicator, 1.15, , 1.26
Wed, 2013.03.27 8:00, 8:00, EUR, medium, German GfK Consumer Climate, 5.9, 5.9, 5.9
Wed, 2013.03.27 8:00, 8:00, EUR, low, German Import Prices m/m, 0.1%, 0.2%, 0.3%
Wed, 2013.03.27 9:00, 9:00, CHF, medium, KOF Economic Barometer, 1.04, 1.07, 0.99
Wed, 2013.03.27 9:00, 9:00, EUR, low, Spanish Flash CPI y/y, 2.8%, 2.7%, 2.4%
Wed, 2013.03.27 10:30, 10:30, GBP, high, Current Account, -15.1B, -12.8B, -14.0B
Wed, 2013.03.27 10:30, 10:30, GBP, medium, Final GDP q/q, -0.3%, -0.3%, -0.3%
Wed, 2013.03.27 10:30, 10:30, GBP, low, FPC Statement, , , 
Wed, 2013.03.27 10:30, 10:30, GBP, low, Revised Business Investment q/q, -1.2%, -1.2%, -0.8%
Wed, 2013.03.27 11:00, 11:00, EUR, low, Italian Retail Sales m/m, -0.1%, 0.4%, -0.5%
Wed, 2013.03.27 11:13, 11:13, EUR, high, Italian 10-y Bond Auction, 4.83|1.7, , 4.66|1.3
Wed, 2013.03.27 13:30, 13:30, CAD, high, Core CPI m/m, 0.1%, 0.3%, 0.8%
Wed, 2013.03.27 13:30, 13:30, CAD, medium, CPI m/m, 0.1%, 0.6%, 1.2%
Wed, 2013.03.27 15:00, 15:00, USD, high, Pending Home Sales m/m, 3.8%, -0.3%, -0.4%
Wed, 2013.03.27 15:30, 15:30, USD, medium, Crude Oil Inventories, -1.3M, 1.5M, 3.3M
Wed, 2013.03.27 16:00, 16:00, USD, medium, FOMC Member Evans Speaks, , , 
Wed, 2013.03.27 16:30, 16:30, USD, medium, FOMC Member Rosengren Speaks, , , 
Wed, 2013.03.27 22:45, 22:45, NZD, medium, Building Consents m/m, -0.2%, , 1.9%
Thu, 2013.03.28 0:30, 0:30, AUD, low, MI Inflation Gauge m/m, 0.0%, , 0.2%
Thu, 2013.03.28 0:50, 0:50, JPY, medium, Retail Sales y/y, -1.1%, 0.9%, -2.3%
Thu, 2013.03.28 1:01, 1:01, GBP, low, GfK Consumer Confidence, -26, -27, -26
Thu, 2013.03.28 1:30, 1:30, AUD, medium, Private Sector Credit m/m, 0.2%, 0.3%, 0.2%
Thu, 2013.03.28 8:00, 8:00, EUR, medium, German Retail Sales m/m, 3.0%, -0.5%, 0.4%
Thu, 2013.03.28 8:00, 8:00, GBP, medium, Nationwide HPI m/m, 0.2%, 0.2%, 0.0%
Thu, 2013.03.28 9:55, 9:55, EUR, medium, German Unemployment Change, 0K, -2K, 13K
Thu, 2013.03.28 10:00, 10:00, EUR, medium, M3 Money Supply y/y, 3.5%, 3.2%, 3.1%
Thu, 2013.03.28 10:00, 10:00, EUR, low, Private Loans y/y, -0.9%, -0.7%, -0.9%
Thu, 2013.03.28 10:10, 10:10, EUR, low, Retail PMI, 44.5, , 43.7
Thu, 2013.03.28 10:30, 10:30, GBP, low, Index of Services 3m/3m, 0.0%, -0.2%, -0.2%
Thu, 2013.03.28 13:30, 13:30, CAD, high, GDP m/m, -0.2%, 0.1%, 0.2%
Thu, 2013.03.28 13:30, 13:30, CAD, medium, RMPI m/m, 3.8%, 1.9%, 2.2%
Thu, 2013.03.28 13:30, 13:30, CAD, low, IPPI m/m, 0.1%, 0.6%, 1.4%
Thu, 2013.03.28 13:30, 13:30, USD, high, Unemployment Claims, 341K, 340K, 357K
Thu, 2013.03.28 13:30, 13:30, USD, medium, Final GDP q/q, 0.1%, 0.5%, 0.4%
Thu, 2013.03.28 13:30, 13:30, USD, low, Final GDP Price Index q/q, 0.9%, 0.9%, 1.0%
Thu, 2013.03.28 14:45, 14:45, USD, medium, Chicago PMI, 56.8, 56.5, 52.4
Thu, 2013.03.28 15:30, 15:30, USD, low, Natural Gas Storage, -62B, -85B, -95B
Thu, 2013.03.28 5:00, 5:00, NZD, holiday, Bank Holiday, , , 
Thu, 2013.03.28 5:00, 5:00, AUD, holiday, Bank Holiday, , , 
Fri, 2013.03.29 0:15, 0:15, JPY, low, Final Manufacturing PMI, 48.5, , 50.4
Fri, 2013.03.29 0:30, 0:30, JPY, medium, Household Spending y/y, 2.4%, 0.4%, 0.8%
Fri, 2013.03.29 0:30, 0:30, JPY, medium, Tokyo Core CPI y/y, -0.6%, -0.6%, -0.5%
Fri, 2013.03.29 0:30, 0:30, JPY, low, National Core CPI y/y, -0.2%, -0.4%, -0.3%
Fri, 2013.03.29 0:30, 0:30, JPY, low, Unemployment Rate, 4.2%, 4.2%, 4.3%
Fri, 2013.03.29 0:50, 0:50, JPY, medium, Prelim Industrial Production m/m, 0.3%, 2.6%, -0.1%
Fri, 2013.03.29 6:00, 6:00, JPY, low, Housing Starts y/y, 5.0%, -1.0%, 3.0%
Fri, 2013.03.29 5:00, 5:00, CHF, holiday, Bank Holiday, , , 
Fri, 2013.03.29 5:00, 5:00, EUR, holiday, German Bank Holiday, , , 
Fri, 2013.03.29 8:45, 8:45, EUR, medium, French Consumer Spending m/m, -0.9%, 0.3%, -0.2%
Fri, 2013.03.29 5:00, 5:00, GBP, holiday, Bank Holiday, , , 
Fri, 2013.03.29 11:00, 11:00, EUR, low, Italian Prelim CPI m/m, 0.1%, 0.3%, 0.3%
Fri, 2013.03.29 5:00, 5:00, CAD, holiday, Bank Holiday, , , 
Fri, 2013.03.29 13:30, 13:30, USD, medium, Core PCE Price Index m/m, 0.2%, 0.1%, 0.1%
Fri, 2013.03.29 13:30, 13:30, USD, medium, Personal Spending m/m, 0.4%, 0.6%, 0.7%
Fri, 2013.03.29 13:30, 13:30, USD, low, Personal Income m/m, -3.7%, 1.0%, 1.1%
Fri, 2013.03.29 14:55, 14:55, USD, medium, Revised UoM Consumer Sentiment, 71.8, 73.2, 78.6
Fri, 2013.03.29 14:55, 14:55, USD, low, Revised UoM Inflation Expectations, 3.3%, , 3.2%
Mon, 2013.04.01 5:00, 5:00, CHF, holiday, Bank Holiday, , , 
Mon, 2013.04.01 5:00, 5:00, EUR, holiday, German Bank Holiday, , , 
Mon, 2013.04.01 5:00, 5:00, EUR, holiday, French Bank Holiday, , , 
Mon, 2013.04.01 5:00, 5:00, EUR, holiday, Italian Bank Holiday, , , 
Mon, 2013.04.01 5:00, 5:00, GBP, holiday, Bank Holiday, , , 
Mon, 2013.04.01 14:00, 14:00, USD, low, Final Manufacturing PMI, 54.9, 55.0, 54.6
Mon, 2013.04.01 15:00, 15:00, USD, high, ISM Manufacturing PMI, 54.2, 54.2, 51.3
Mon, 2013.04.01 15:00, 15:00, USD, low, Construction Spending m/m, -2.1%, 1.1%, 1.2%
Mon, 2013.04.01 15:00, 15:00, USD, low, ISM Manufacturing Prices, 61.5, 60.1, 54.5
